{
  "$schema": "https://json-schema.org/draft/2020-12/schema",
  "$id": "https://example.org/rtd/usage.schema.json",
  "title": "Naming Usage",
  "description": "(system, workout) -> what that system calls it. Naming is a join, not a field: putting name='tempo run' on a workout row makes the dataset wrong on arrival, because Daniels' tempo is threshold and Hansons' tempo is marathon pace.",
  "type": "object",
  "additionalProperties": false,
  "required": ["system", "workout", "calls_it"],
  "properties": {
    "system": {
      "type": ["string", "null"],
      "description": "A system id, or null for folk usage belonging to no system."
    },
    "workout": {
      "type": "string",
      "description": "A workout id."
    },
    "calls_it": {
      "type": "string",
      "description": "The colloquial name as used. This is the only place a colloquial name may live."
    },
    "also_known_as": {
      "type": "array",
      "minItems": 1,
      "items": {
        "type": "string"
      }
    },
    "collides": {
      "type": "boolean",
      "description": "true = this name maps to a different workout in another system. Derivable from the table, stored so the renderer can flag without a scan."
    },
    "note": {
      "$ref": "#/$defs/i18n"
    }
  },
  "$defs": {
    "i18n": {
      "type": "string",
      "description": "Korean prose. The dataset is Korean-only; English survives only where it is data rather than translation - colloquial names, canonical names, attributions and citations."
    }
  }
}
