[
  {
    "system": "daniels",
    "workout": "easy-run",
    "calls_it": "E pace run",
    "also_known_as": ["Easy run"],
    "note": "VDOT 표에서 유도된 E 페이스. 상한이 있다는 점이 핵심이며, 너무 빠른 E는 E가 아니다."
  },
  {
    "system": "daniels",
    "workout": "threshold-continuous",
    "calls_it": "Tempo run",
    "collides": true,
    "note": "Daniels의 tempo는 역치(T) 페이스, 약 60분 레이스 페이스다. Hansons의 tempo와 같은 단어, 다른 강도."
  },
  {
    "system": "daniels",
    "workout": "vo2max-intervals",
    "calls_it": "I pace intervals",
    "note": "I 존은 VO2max 부근. Daniels는 세션당 볼륨 상한을 명시하는 드문 훈련법이다."
  },
  {
    "system": "daniels",
    "workout": "strides",
    "calls_it": "Strides",
    "note": "이름 충돌이 없는 드문 경우. 훈련법 간 합의된 몇 안 되는 용어다."
  },
  {
    "system": "hansons",
    "workout": "easy-run",
    "calls_it": "Easy run",
    "note": "누적 피로가 전제라, 여기서의 easy는 회복이 아니라 피로 위에 얹는 볼륨이다."
  },
  {
    "system": "hansons",
    "workout": "marathon-pace-run",
    "calls_it": "Tempo run",
    "collides": true,
    "note": "Hansons의 tempo는 목표 마라톤 페이스다. Daniels에서 넘어오면 같은 단어를 쓰면서 느려지고, 아무도 알려주지 않는다."
  },
  {
    "system": "hansons",
    "workout": "threshold-continuous",
    "calls_it": "Strength workout",
    "note": "Hansons는 이 강도를 tempo가 아니라 strength라 부른다. tempo라는 이름을 마라톤 페이스에 이미 써버렸기 때문이다."
  },
  {
    "system": "hansons",
    "workout": "vo2max-intervals",
    "calls_it": "Speed workout",
    "note": "'speed'가 VO2max 인터벌을 가리킨다. 다른 훈련법에서 speed는 보통 신경근 자극(스트라이드/R 페이스)이다."
  },
  {
    "system": "polarized-80-20",
    "workout": "easy-run",
    "calls_it": "Zone 1 run",
    "also_known_as": ["Low-intensity session", "LIT"],
    "note": "존 1은 LT1 아래. 이 훈련법에서 easy-run은 세션의 약 80%를 차지하는 기본값이다."
  },
  {
    "system": "polarized-80-20",
    "workout": "vo2max-intervals",
    "calls_it": "Zone 3 interval",
    "also_known_as": ["High-intensity session", "HIT"],
    "note": "20% 몫의 거의 전부가 여기로 간다. 역치 세션이 금지되므로 고강도 선택지가 좁다."
  },
  {
    "system": null,
    "workout": "easy-run",
    "calls_it": "Base run",
    "also_known_as": ["Zone 2 run", "Aerobic run"],
    "note": "훈련법 밖의 일상 용어. 'Zone 2 run'의 존 번호는 어느 훈련법의 존인지 말하지 않는다는 점에서 이름 충돌보다 더 나쁘다."
  },
  {
    "system": null,
    "workout": "strides",
    "calls_it": "Pickups",
    "also_known_as": ["Accelerations"],
    "note": "코치에 따라 pickup은 스트라이드보다 훨씬 긴 구간을 뜻하기도 한다. 그래서 워크아웃 id에서 금지된 단어다."
  },
  {
    "system": "daniels",
    "workout": "long-run",
    "calls_it": "L run",
    "also_known_as": ["Long E run"],
    "note": "Daniels에게 롱런은 E 강도의 연장이다. 별도 '롱런 페이스'가 있는 게 아니라 그냥 긴 E다."
  },
  {
    "system": "hansons",
    "workout": "long-run",
    "calls_it": "Long run",
    "note": "Hansons의 롱런은 16마일(약 26km)로 상한이 있다. 누적 피로 전제에서 롱런을 늘리는 대신 주 전체 볼륨을 택한 결과다."
  },
  {
    "system": null,
    "workout": "long-run",
    "calls_it": "LSD",
    "also_known_as": ["Long slow distance", "Long steady run"],
    "note": "'Long slow distance'의 slow가 강도를 지시하는 유일한 단어인데, 어느 훈련법의 느림인지는 말하지 않는다."
  },
  {
    "system": null,
    "workout": "recovery-run",
    "calls_it": "Recovery run",
    "also_known_as": ["Recovery jog", "Shakeout"],
    "note": "훈련법 밖 일상 용어. shakeout은 레이스 전날의 아주 짧은 회복런을 따로 가리키기도 한다."
  },
  {
    "system": "daniels",
    "workout": "threshold-intervals",
    "calls_it": "Cruise intervals",
    "also_known_as": ["T intervals"],
    "note": "Daniels가 만든 용어. threshold-continuous('Tempo')와 같은 T 페이스지만 짧은 회복으로 나눈 형태다."
  },
  {
    "system": null,
    "workout": "hill-repeats",
    "calls_it": "Hill repeats",
    "also_known_as": ["Hill reps"],
    "note": "'Hill sprints'와 혼동되지만 후자는 보통 10초 이하의 순수 신경근 자극이라 다른 워크아웃이다."
  },
  {
    "system": null,
    "workout": "fartlek",
    "calls_it": "Fartlek",
    "also_known_as": ["Speed play"],
    "note": "스웨덴어로 '스피드 플레이'. 1930년대 Gösta Holmér가 고안한 이름이 그대로 종목 용어가 됐다."
  },
  {
    "system": "lydiard",
    "workout": "easy-run",
    "calls_it": "Aerobic run",
    "also_known_as": ["Steady state run"],
    "note": "Lydiard의 베이스는 '가장 좋은 유산소 노력'으로 달리는 aerobic run이다. steady state는 그 상단, 무산소 직전을 가리킨다."
  },
  {
    "system": "lydiard",
    "workout": "hill-repeats",
    "calls_it": "Hill bounding",
    "also_known_as": ["Hill springing"],
    "note": "Lydiard의 언덕 국면은 페이스 반복이 아니라 튕겨 오르는 바운딩/스프링잉 드릴이다. 같은 'hill'이라도 다른 동작."
  },
  {
    "system": "pfitzinger",
    "workout": "threshold-continuous",
    "calls_it": "LT run",
    "also_known_as": ["Lactate threshold run", "Tempo run"],
    "note": "Pfitzinger는 이를 젖산 역치(LT) 주행이라 부르고 HR 82~91%로 처방한다. Daniels의 'Tempo'와 같은 강도 영역이지만 앵커가 페이스가 아니라 HR이다."
  },
  {
    "system": "pfitzinger",
    "workout": "marathon-pace-run",
    "calls_it": "MP run",
    "also_known_as": ["Marathon-pace run"],
    "note": "Pfitzinger는 긴 주행 안에 마라톤 페이스 구간을 넣는다. Hansons의 'tempo=마라톤 페이스'와 같은 강도지만 이름이 충돌하지 않는다."
  },
  {
    "system": "pfitzinger",
    "workout": "long-run",
    "calls_it": "Medium-long run",
    "also_known_as": ["Long run"],
    "note": "Pfitzinger는 미디엄-롱런(약 15~23km)과 롱런(23km 이상)을 명시적으로 구분한다. 대부분의 훈련법이 뭉뚱그리는 지점을 쪼갠다."
  },
  {
    "system": "maf",
    "workout": "easy-run",
    "calls_it": "MAF run",
    "also_known_as": ["Aerobic base run", "MAF test"],
    "note": "모든 주행이 MAF HR 이하다. 매월 같은 HR에서의 페이스를 재는 것이 'MAF 테스트'이고, 그 페이스 향상이 유일한 진전 지표다."
  },
  {
    "system": "norwegian-singles",
    "workout": "threshold-continuous",
    "calls_it": "Sub-threshold",
    "also_known_as": ["Sub-T", "Threshold run"],
    "note": "MLSS 아래(약 2~3mmol)로 통제한다. Daniels의 T('Tempo')와 같은 워크아웃이지만 타깃 젖산이 더 낮아 더 느리다."
  },
  {
    "system": "norwegian-singles",
    "workout": "threshold-intervals",
    "calls_it": "Threshold intervals",
    "also_known_as": ["Double threshold", "Sub-threshold intervals"],
    "note": "Daniels의 'cruise intervals'와 같은 형태지만 젖산으로 통제하고, 엘리트는 이를 하루 두 번(더블 역치) 수행한다."
  },
  {
    "system": "critical-speed",
    "workout": "threshold-continuous",
    "calls_it": "CS run",
    "also_known_as": ["Critical speed effort", "At-CS run"],
    "note": "임계속도 바로 부근의 연속 주행. Daniels의 T('Tempo')와 강도 영역이 겹치지만, 여기서는 감각이 아니라 측정된 CS로 못박힌다."
  },
  {
    "system": "critical-speed",
    "workout": "vo2max-intervals",
    "calls_it": "Above-CS intervals",
    "also_known_as": ["W-prime intervals", "D-prime work"],
    "note": "CS 위에서 유한한 여력 W′(D′)을 계획적으로 소진하는 인터벌. '얼마나 위인지'가 아니라 '얼마나 W′을 쓰는지'로 설계한다."
  },
  {
    "system": "hrr-karvonen",
    "workout": "easy-run",
    "calls_it": "Zone 2",
    "also_known_as": ["Aerobic zone (60-70% HRR)"],
    "note": "여기서 'Zone 2'는 60~70% HRR로 명확히 정의된다. 어느 훈련법의 존인지 말하지 않는 일상 용어 'Zone 2 run'과 정확히 대비되는 지점이다."
  },
  {
    "system": "canova",
    "workout": "marathon-pace-run",
    "calls_it": "Specific pace run",
    "also_known_as": ["Special block", "Marathon-specific work"],
    "note": "Canova는 목표 페이스 부근의 대량 작업을 'specific'/'special block'이라 부른다. Hansons·Pfitzinger의 마라톤 페이스 주행과 같은 강도지만 조직 원리가 다르다."
  },
  {
    "system": "galloway",
    "workout": "long-run",
    "calls_it": "Run-walk long run",
    "also_known_as": ["Long run with walk breaks"],
    "note": "같은 롱런이지만 계획된 걷기로 끊는다. GPS 평균 페이스가 걷기 때문에 다른 훈련법의 롱런과 직접 비교되지 않는다."
  },
  {
    "system": "galloway",
    "workout": "easy-run",
    "calls_it": "Run-walk",
    "also_known_as": ["Walk-break run"],
    "note": "일상 주행조차 달리기-걷기 비율(예: 4:1)로 정의된다. 걷기 구간이 워크아웃의 정의적 특징이다."
  },
  {
    "system": "first-furman",
    "workout": "vo2max-intervals",
    "calls_it": "Key Run 1",
    "also_known_as": ["Track repeats", "Speed key run"],
    "note": "FIRST의 세 '키 런' 중 첫째, 트랙 반복이다. 나머지 이지 볼륨은 크로스 트레이닝이 대신한다."
  },
  {
    "system": "first-furman",
    "workout": "threshold-continuous",
    "calls_it": "Key Run 2",
    "also_known_as": ["Tempo key run"],
    "note": "FIRST의 둘째 키 런, 템포다. threshold-continuous는 이제 다섯 번째 이름을 얻는다 — 훈련법마다 같은 워크아웃을 다르게 부른다."
  },
  {
    "system": "first-furman",
    "workout": "long-run",
    "calls_it": "Key Run 3",
    "also_known_as": ["Long key run"],
    "note": "FIRST의 셋째 키 런, 롱런이다. 목표 페이스에서 유도된 페이스로 달리는 경우가 많다."
  },
  {
    "system": null,
    "workout": "progression-run",
    "calls_it": "Progression run",
    "also_known_as": ["Fast-finish run", "Negative-split run"],
    "note": "훈련법 밖 용어. 'negative split'은 결과(후반이 빠름)를, 'progression'은 방법을 가리킨다."
  },
  {
    "system": null,
    "workout": "vo2max-30-30",
    "calls_it": "30-30s",
    "also_known_as": ["Short intervals", "Billat intervals"],
    "note": "30초 노력/30초 회복. Billat의 연구로 대중화돼 그의 이름이 붙기도 한다."
  },
  {
    "system": "polarized-80-20",
    "workout": "vo2max-30-30",
    "calls_it": "Zone 3 short intervals",
    "note": "폴라라이즈드에서 20% 몫의 고강도를 짧은 반복으로 채우는 흔한 형태다."
  },
  {
    "system": "daniels",
    "workout": "rep-intervals",
    "calls_it": "R pace reps",
    "also_known_as": ["Repetitions", "R intervals"],
    "note": "Daniels의 R 존. VDOT에서 유도되며 대사가 아니라 신경근·이코노미를 노린다."
  },
  {
    "system": null,
    "workout": "downhill-repeats",
    "calls_it": "Downhill repeats",
    "also_known_as": ["Eccentric hill reps", "Downhill strides"],
    "note": "신전성 부하가 정의적 특징이다. 오르막 반복과 정반대의 근육 자극."
  },
  {
    "system": null,
    "workout": "race-pace-intervals",
    "calls_it": "Race-pace intervals",
    "also_known_as": ["Goal-pace intervals", "Specific intervals"],
    "note": "목표 페이스를 인터벌로 반복한다. 어느 거리의 레이스 페이스인지에 따라 강도가 달라진다."
  },
  {
    "system": null,
    "workout": "hill-sprints",
    "calls_it": "Hill sprints",
    "also_known_as": ["Short hill sprints", "Neuromuscular hill sprints"],
    "note": "8~10초 최대 노력. hill-repeats(30~90초)와 자주 혼동되지만 목적과 지속이 완전히 다르다."
  },
  {
    "system": null,
    "workout": "anaerobic-intervals",
    "calls_it": "Speed endurance",
    "also_known_as": ["Anaerobic intervals", "Lactate tolerance reps"],
    "note": "중장거리 트랙 전통 용어. 젖산 내성을 노리는 소수 정예 세션이다."
  },
  {
    "system": "canova",
    "workout": "pace-alternations",
    "calls_it": "Alternations",
    "also_known_as": ["Canova alternations", "Alternazioni"],
    "note": "Canova의 대표 세션. 이지 회복 없이 빠른 구간과 마라톤 페이스 플로트를 번갈은다."
  },
  {
    "system": "daniels",
    "workout": "time-trial",
    "calls_it": "Time trial",